{
  "schemaVersion": "1.0",
  "id": "bandwidth-vs-cost",
  "name": "Bandwidth vs Cost",
  "description": "Diamond topology demonstrating trade-offs between low-cost narrow paths vs higher-cost wider paths.",
  "nodes": [
    {
      "id": "host-a",
      "name": "Host A",
      "type": "host",
      "adminState": "up",
      "defaultGateway": "10.1.0.1",
      "interfaces": [
        {
          "id": "eth0",
          "name": "eth0",
          "adminState": "up",
          "ipv4Address": "10.1.0.10",
          "prefixLength": 24,
          "macAddress": "02:00:00:01:00:01",
          "mtuBytes": null
        }
      ]
    },
    {
      "id": "host-b",
      "name": "Host B",
      "type": "host",
      "adminState": "up",
      "defaultGateway": "10.2.0.1",
      "interfaces": [
        {
          "id": "eth0",
          "name": "eth0",
          "adminState": "up",
          "ipv4Address": "10.2.0.20",
          "prefixLength": 24,
          "macAddress": "02:00:00:06:00:01",
          "mtuBytes": null
        }
      ]
    },
    {
      "id": "r1",
      "name": "Router 1",
      "type": "router",
      "adminState": "up",
      "defaultGateway": null,
      "forwardingEnabled": true,
      "staticRoutes": [
        {
          "prefix": "10.2.0.0/24",
          "nextHop": "10.12.0.2",
          "outInterface": "eth1",
          "adminPreference": 1,
          "metric": 0
        }
      ],
      "interfaces": [
        {
          "id": "eth0",
          "name": "eth0",
          "adminState": "up",
          "ipv4Address": "10.1.0.1",
          "prefixLength": 24,
          "macAddress": "02:00:00:02:00:01",
          "mtuBytes": null
        },
        {
          "id": "eth1",
          "name": "eth1",
          "adminState": "up",
          "ipv4Address": "10.12.0.1",
          "prefixLength": 30,
          "macAddress": "02:00:00:02:00:02",
          "mtuBytes": null
        },
        {
          "id": "eth2",
          "name": "eth2",
          "adminState": "up",
          "ipv4Address": "10.13.0.1",
          "prefixLength": 30,
          "macAddress": "02:00:00:02:00:03",
          "mtuBytes": null
        }
      ]
    },
    {
      "id": "r2",
      "name": "Router 2",
      "type": "router",
      "adminState": "up",
      "defaultGateway": null,
      "forwardingEnabled": true,
      "staticRoutes": [
        {
          "prefix": "10.1.0.0/24",
          "nextHop": "10.12.0.1",
          "outInterface": "eth0",
          "adminPreference": 1,
          "metric": 0
        },
        {
          "prefix": "10.2.0.0/24",
          "nextHop": "10.24.0.2",
          "outInterface": "eth1",
          "adminPreference": 1,
          "metric": 0
        }
      ],
      "interfaces": [
        {
          "id": "eth0",
          "name": "eth0",
          "adminState": "up",
          "ipv4Address": "10.12.0.2",
          "prefixLength": 30,
          "macAddress": "02:00:00:03:00:01",
          "mtuBytes": null
        },
        {
          "id": "eth1",
          "name": "eth1",
          "adminState": "up",
          "ipv4Address": "10.24.0.1",
          "prefixLength": 30,
          "macAddress": "02:00:00:03:00:02",
          "mtuBytes": null
        }
      ]
    },
    {
      "id": "r3",
      "name": "Router 3",
      "type": "router",
      "adminState": "up",
      "defaultGateway": null,
      "forwardingEnabled": true,
      "staticRoutes": [
        {
          "prefix": "10.1.0.0/24",
          "nextHop": "10.13.0.1",
          "outInterface": "eth0",
          "adminPreference": 1,
          "metric": 0
        },
        {
          "prefix": "10.2.0.0/24",
          "nextHop": "10.34.0.2",
          "outInterface": "eth1",
          "adminPreference": 1,
          "metric": 0
        }
      ],
      "interfaces": [
        {
          "id": "eth0",
          "name": "eth0",
          "adminState": "up",
          "ipv4Address": "10.13.0.2",
          "prefixLength": 30,
          "macAddress": "02:00:00:04:00:01",
          "mtuBytes": null
        },
        {
          "id": "eth1",
          "name": "eth1",
          "adminState": "up",
          "ipv4Address": "10.34.0.1",
          "prefixLength": 30,
          "macAddress": "02:00:00:04:00:02",
          "mtuBytes": null
        }
      ]
    },
    {
      "id": "r4",
      "name": "Router 4",
      "type": "router",
      "adminState": "up",
      "defaultGateway": null,
      "forwardingEnabled": true,
      "staticRoutes": [
        {
          "prefix": "10.1.0.0/24",
          "nextHop": "10.24.0.1",
          "outInterface": "eth0",
          "adminPreference": 1,
          "metric": 0
        }
      ],
      "interfaces": [
        {
          "id": "eth0",
          "name": "eth0",
          "adminState": "up",
          "ipv4Address": "10.24.0.2",
          "prefixLength": 30,
          "macAddress": "02:00:00:05:00:01",
          "mtuBytes": null
        },
        {
          "id": "eth1",
          "name": "eth1",
          "adminState": "up",
          "ipv4Address": "10.34.0.2",
          "prefixLength": 30,
          "macAddress": "02:00:00:05:00:02",
          "mtuBytes": null
        },
        {
          "id": "eth2",
          "name": "eth2",
          "adminState": "up",
          "ipv4Address": "10.2.0.1",
          "prefixLength": 24,
          "macAddress": "02:00:00:05:00:03",
          "mtuBytes": null
        }
      ]
    }
  ],
  "links": [
    {
      "id": "ha",
      "a": {
        "nodeId": "host-a",
        "interfaceId": "eth0"
      },
      "b": {
        "nodeId": "r1",
        "interfaceId": "eth0"
      },
      "adminState": "up",
      "directionality": "bidirectional",
      "cost": 1.0,
      "bandwidthBps": 1000000000,
      "availableBandwidthBps": null,
      "propagationDelayMs": 1.0,
      "packetLossProbability": 0.0,
      "mtuBytes": 1500
    },
    {
      "id": "l12",
      "a": {
        "nodeId": "r1",
        "interfaceId": "eth1"
      },
      "b": {
        "nodeId": "r2",
        "interfaceId": "eth0"
      },
      "adminState": "up",
      "directionality": "bidirectional",
      "cost": 1.0,
      "bandwidthBps": 10000000,
      "availableBandwidthBps": null,
      "propagationDelayMs": 1.0,
      "packetLossProbability": 0.0,
      "mtuBytes": 1500
    },
    {
      "id": "l13",
      "a": {
        "nodeId": "r1",
        "interfaceId": "eth2"
      },
      "b": {
        "nodeId": "r3",
        "interfaceId": "eth0"
      },
      "adminState": "up",
      "directionality": "bidirectional",
      "cost": 5.0,
      "bandwidthBps": 1000000000,
      "availableBandwidthBps": null,
      "propagationDelayMs": 1.0,
      "packetLossProbability": 0.0,
      "mtuBytes": 1500
    },
    {
      "id": "l24",
      "a": {
        "nodeId": "r2",
        "interfaceId": "eth1"
      },
      "b": {
        "nodeId": "r4",
        "interfaceId": "eth0"
      },
      "adminState": "up",
      "directionality": "bidirectional",
      "cost": 1.0,
      "bandwidthBps": 10000000,
      "availableBandwidthBps": null,
      "propagationDelayMs": 1.0,
      "packetLossProbability": 0.0,
      "mtuBytes": 1500
    },
    {
      "id": "l34",
      "a": {
        "nodeId": "r3",
        "interfaceId": "eth1"
      },
      "b": {
        "nodeId": "r4",
        "interfaceId": "eth1"
      },
      "adminState": "up",
      "directionality": "bidirectional",
      "cost": 5.0,
      "bandwidthBps": 1000000000,
      "availableBandwidthBps": null,
      "propagationDelayMs": 1.0,
      "packetLossProbability": 0.0,
      "mtuBytes": 1500
    },
    {
      "id": "lb",
      "a": {
        "nodeId": "r4",
        "interfaceId": "eth2"
      },
      "b": {
        "nodeId": "host-b",
        "interfaceId": "eth0"
      },
      "adminState": "up",
      "directionality": "bidirectional",
      "cost": 1.0,
      "bandwidthBps": 1000000000,
      "availableBandwidthBps": null,
      "propagationDelayMs": 1.0,
      "packetLossProbability": 0.0,
      "mtuBytes": 1500
    }
  ]
}
