{
  "schemaVersion": "1.0",
  "id": "no-route",
  "name": "No Route",
  "description": "Topology containing deliberate routing gaps to demonstrate NO_ROUTE errors at host and router levels.",
  "nodes": [
    {
      "id": "host-a",
      "name": "Host A",
      "type": "host",
      "adminState": "up",
      "defaultGateway": null,
      "interfaces": [
        {
          "id": "eth0",
          "name": "eth0",
          "adminState": "up",
          "ipv4Address": "192.168.1.10",
          "prefixLength": 24,
          "macAddress": "02:00:00:01:00:01",
          "mtuBytes": null
        }
      ]
    },
    {
      "id": "host-b",
      "name": "Host B",
      "type": "host",
      "adminState": "up",
      "defaultGateway": "10.0.0.1",
      "interfaces": [
        {
          "id": "eth0",
          "name": "eth0",
          "adminState": "up",
          "ipv4Address": "10.0.0.20",
          "prefixLength": 24,
          "macAddress": "02:00:00:04:00:01",
          "mtuBytes": null
        }
      ]
    },
    {
      "id": "host-c",
      "name": "Host C",
      "type": "host",
      "adminState": "up",
      "defaultGateway": "172.16.0.1",
      "interfaces": [
        {
          "id": "eth0",
          "name": "eth0",
          "adminState": "up",
          "ipv4Address": "172.16.0.10",
          "prefixLength": 24,
          "macAddress": "02:00:00:06:00:01",
          "mtuBytes": null
        }
      ]
    },
    {
      "id": "host-d",
      "name": "Host D",
      "type": "host",
      "adminState": "up",
      "defaultGateway": "192.168.1.1",
      "interfaces": [
        {
          "id": "eth0",
          "name": "eth0",
          "adminState": "up",
          "ipv4Address": "192.168.1.30",
          "prefixLength": 24,
          "macAddress": "02:00:00:02:00:01",
          "mtuBytes": null
        }
      ]
    },
    {
      "id": "r1",
      "name": "Router 1",
      "type": "router",
      "adminState": "up",
      "defaultGateway": null,
      "forwardingEnabled": true,
      "interfaces": [
        {
          "id": "eth0",
          "name": "eth0",
          "adminState": "up",
          "ipv4Address": "192.168.1.1",
          "prefixLength": 24,
          "macAddress": "02:00:00:03:00:01",
          "mtuBytes": null
        },
        {
          "id": "eth1",
          "name": "eth1",
          "adminState": "up",
          "ipv4Address": "10.0.0.1",
          "prefixLength": 24,
          "macAddress": "02:00:00:03:00:02",
          "mtuBytes": null
        },
        {
          "id": "eth2",
          "name": "eth2",
          "adminState": "up",
          "ipv4Address": "10.9.0.1",
          "prefixLength": 24,
          "macAddress": "02:00:00:03:00:03",
          "mtuBytes": null
        }
      ]
    },
    {
      "id": "r2",
      "name": "Router 2",
      "type": "router",
      "adminState": "up",
      "defaultGateway": null,
      "forwardingEnabled": true,
      "staticRoutes": [
        {
          "prefix": "10.0.0.0/24",
          "nextHop": "10.9.0.1",
          "outInterface": "eth0",
          "adminPreference": 1,
          "metric": 0
        },
        {
          "prefix": "192.168.1.0/24",
          "nextHop": "10.9.0.1",
          "outInterface": "eth0",
          "adminPreference": 1,
          "metric": 0
        }
      ],
      "interfaces": [
        {
          "id": "eth0",
          "name": "eth0",
          "adminState": "up",
          "ipv4Address": "10.9.0.2",
          "prefixLength": 24,
          "macAddress": "02:00:00:05:00:01",
          "mtuBytes": null
        },
        {
          "id": "eth1",
          "name": "eth1",
          "adminState": "up",
          "ipv4Address": "172.16.0.1",
          "prefixLength": 24,
          "macAddress": "02:00:00:05:00:02",
          "mtuBytes": null
        }
      ]
    },
    {
      "id": "sw1",
      "name": "Switch 1",
      "type": "switch",
      "adminState": "up",
      "defaultGateway": null,
      "interfaces": [
        {
          "id": "p1",
          "name": "p1",
          "adminState": "up",
          "ipv4Address": null,
          "prefixLength": null,
          "macAddress": null,
          "mtuBytes": null
        },
        {
          "id": "p2",
          "name": "p2",
          "adminState": "up",
          "ipv4Address": null,
          "prefixLength": null,
          "macAddress": null,
          "mtuBytes": null
        },
        {
          "id": "p3",
          "name": "p3",
          "adminState": "up",
          "ipv4Address": null,
          "prefixLength": null,
          "macAddress": null,
          "mtuBytes": null
        }
      ]
    }
  ],
  "links": [
    {
      "id": "l12",
      "a": {
        "nodeId": "r1",
        "interfaceId": "eth2"
      },
      "b": {
        "nodeId": "r2",
        "interfaceId": "eth0"
      },
      "adminState": "up",
      "directionality": "bidirectional",
      "cost": 1.0,
      "bandwidthBps": 100000000,
      "availableBandwidthBps": null,
      "propagationDelayMs": 1.0,
      "packetLossProbability": 0.0,
      "mtuBytes": 1500
    },
    {
      "id": "l1b",
      "a": {
        "nodeId": "r1",
        "interfaceId": "eth1"
      },
      "b": {
        "nodeId": "host-b",
        "interfaceId": "eth0"
      },
      "adminState": "up",
      "directionality": "bidirectional",
      "cost": 1.0,
      "bandwidthBps": 100000000,
      "availableBandwidthBps": null,
      "propagationDelayMs": 1.0,
      "packetLossProbability": 0.0,
      "mtuBytes": 1500
    },
    {
      "id": "l2c",
      "a": {
        "nodeId": "r2",
        "interfaceId": "eth1"
      },
      "b": {
        "nodeId": "host-c",
        "interfaceId": "eth0"
      },
      "adminState": "up",
      "directionality": "bidirectional",
      "cost": 1.0,
      "bandwidthBps": 100000000,
      "availableBandwidthBps": null,
      "propagationDelayMs": 1.0,
      "packetLossProbability": 0.0,
      "mtuBytes": 1500
    },
    {
      "id": "lA",
      "a": {
        "nodeId": "host-a",
        "interfaceId": "eth0"
      },
      "b": {
        "nodeId": "sw1",
        "interfaceId": "p1"
      },
      "adminState": "up",
      "directionality": "bidirectional",
      "cost": 1.0,
      "bandwidthBps": 100000000,
      "availableBandwidthBps": null,
      "propagationDelayMs": 1.0,
      "packetLossProbability": 0.0,
      "mtuBytes": 1500
    },
    {
      "id": "lD",
      "a": {
        "nodeId": "host-d",
        "interfaceId": "eth0"
      },
      "b": {
        "nodeId": "sw1",
        "interfaceId": "p2"
      },
      "adminState": "up",
      "directionality": "bidirectional",
      "cost": 1.0,
      "bandwidthBps": 100000000,
      "availableBandwidthBps": null,
      "propagationDelayMs": 1.0,
      "packetLossProbability": 0.0,
      "mtuBytes": 1500
    },
    {
      "id": "lR1",
      "a": {
        "nodeId": "r1",
        "interfaceId": "eth0"
      },
      "b": {
        "nodeId": "sw1",
        "interfaceId": "p3"
      },
      "adminState": "up",
      "directionality": "bidirectional",
      "cost": 1.0,
      "bandwidthBps": 100000000,
      "availableBandwidthBps": null,
      "propagationDelayMs": 1.0,
      "packetLossProbability": 0.0,
      "mtuBytes": 1500
    }
  ]
}
